{
  "document_type": "case_study",
  "locale": "zh-CN",
  "meta": {
    "title": "北极星科技：用数据分析驱动用户增长 300%",
    "subtitle": "从数据混乱到增长飞轮的完整转型实践",
    "eyebrow": "Momo Paper / case_study / zh-CN"
  },
  "sections": {
    "context": {
      "body": [
        "北极星科技是一家面向中小企业的 CRM SaaS 公司，2023 年初拥有 5,000 家付费客户，ARR 约 800 万元。CEO 意识到增长放缓，但团队对「为什么增长放缓」没有共识。"
      ]
    },
    "problem": {
      "body": [
        "核心问题：数据散落在 6 个不同系统中，没有统一的用户行为视图。产品、市场、销售团队各自为政，决策靠直觉而非数据。"
      ],
      "metrics": [
        { "label": "数据系统数量", "value": "6" },
        { "label": "月度活跃率", "value": "32%" },
        { "label": "获客成本", "value": "¥4,200" }
      ]
    },
    "approach": {
      "body": [
        "我们为北极星科技设计了一套数据驱动增长体系，分四个阶段实施。"
      ],
      "steps": [
        "搭建统一数据仓库，整合 6 个系统的用户行为数据",
        "建立用户分层模型（高价值 / 潜力 / 流失风险），实现精细化运营",
        "设计增长实验框架，每两周运行 2-3 个 A/B 测试",
        "构建实时看板，让全团队随时查看核心指标"
      ]
    },
    "evidence": {
      "body": [
        "6 个月后，数据体系全面运转，增长实验开始产生显著效果。"
      ],
      "results": [
        { "label": "付费用户增长", "value": "300%", "change": "从 5,000 到 15,000" },
        { "label": "月度活跃率", "value": "68%", "change": "+36%" },
        { "label": "获客成本", "value": "¥1,800", "change": "-57%" },
        { "label": "ARR", "value": "2,400万", "change": "+200%" }
      ]
    },
    "outcome": {
      "body": [
        "北极星科技从「靠直觉增长」转型为「靠数据增长」。CEO 表示：「现在我们开会不再争论『我觉得』，而是直接看数据说话。」"
      ]
    },
    "takeaway": {
      "body": [
        "这个案例展示了数据基础设施对 SaaS 增长的杠杆效应。"
      ],
      "lessons": [
        "数据整合是第一步，没有统一数据就谈不上数据驱动",
        "用户分层是精细化运营的前提，一刀切的策略效率极低",
        "增长实验需要结构化框架，随机测试会浪费资源",
        "实时看板让数据透明化，是建立数据文化的关键工具"
      ]
    }
  }
}
